{
  "workflow_name": "prelicensure-qsen-aacn-crosswalk-workset",
  "objective": "Create a structured local release workbook from the QSEN Prelicensure to AACN Entry Level competency crosswalk workbook.",
  "deliverables": [
    "prelicensure_qsen_aacn_crosswalk_release.xlsx",
    "prelicensure_crosswalk_qa.json",
    "execution_order.json",
    "execution_checklist.md"
  ],
  "source_priority": [
    "C:\\Users\\RHarrity\\Downloads\\Prelicensure Workbook.xlsx",
    "nursing-crosswalk-agent scaffold"
  ],
  "blocking_rules": [
    "Do not modify source workbook or source archive.",
    "Treat Entry Level as the canonical source for QSEN rows and aggregate AACN mappings.",
    "Use rows 1-5 as metadata/header rows and rows 6+ as data rows.",
    "Forward-fill blank QSEN domain and KSA values caused by merged-cell layout.",
    "Use the 10 domain sheets only for QA reconciliation.",
    "Preserve raw source labels and typos exactly in *_raw fields.",
    "Do not invent mappings; ambiguous, malformed, duplicate, or parent-prefix-mismatched mappings must be flagged needs_review."
  ],
  "stage_order": [
    "intake",
    "inventory",
    "normalize",
    "facts",
    "dimensions",
    "bridges",
    "governance",
    "master",
    "coverage",
    "release",
    "qa"
  ],
  "jobs": [
    {
      "job_id": "J00-intake",
      "stage": "intake",
      "title": "Confirm local workset inputs and output contract",
      "objective": "Confirm source files, workset folder, release workbook name, QA artifact names, and read-only source policy.",
      "inputs": [
        "C:\\Users\\RHarrity\\Downloads\\Prelicensure Workbook.xlsx",
        "C:\\Users\\RHarrity\\Downloads\\nursing-crosswalk-agent.zip"
      ],
      "outputs": [
        "workset_manifest.json"
      ],
      "validation_checks": [
        "source workbook exists",
        "source archive exists",
        "workset folder exists"
      ]
    },
    {
      "job_id": "J10-inventory",
      "stage": "inventory",
      "title": "Inventory workbook sheets and source shape",
      "objective": "Profile sheet names, dimensions, header rows, data rows, mapped cells, and source hash.",
      "depends_on": [
        "J00-intake"
      ],
      "inputs": [
        "Prelicensure Workbook.xlsx"
      ],
      "outputs": [
        "build/intermediate/source_inventory.json"
      ],
      "validation_checks": [
        "sheet count equals 11",
        "Entry Level data row count equals 214",
        "Entry Level mapped cell count equals 651 before splitting multi-code cells"
      ]
    },
    {
      "job_id": "J20-normalize",
      "stage": "normalize",
      "title": "Normalize canonical QSEN rows and AACN mapping cells",
      "objective": "Forward-fill merged QSEN fields, split comma-separated subcompetency codes, preserve raw cells, and flag review conditions.",
      "depends_on": [
        "J10-inventory"
      ],
      "inputs": [
        "Entry Level sheet"
      ],
      "outputs": [
        "build/intermediate/crosswalk_data.json"
      ],
      "validation_checks": [
        "no source row is silently dropped",
        "raw mapping cell values are preserved",
        "review flags are explicit"
      ]
    },
    {
      "job_id": "J30-dimensions",
      "stage": "dimensions",
      "title": "Build dimensions and fact table",
      "objective": "Build QSEN domain, KSA, AACN domain, AACN competency, and QSEN statement tables.",
      "depends_on": [
        "J20-normalize"
      ],
      "outputs": [
        "Dim_QSEN_Domain",
        "Dim_KSA",
        "Dim_AACN_Domain",
        "Dim_AACN_Competency",
        "Fact_QSEN_Statements"
      ],
      "validation_checks": [
        "dimension keys are stable",
        "fact statement count matches normalized source rows"
      ]
    },
    {
      "job_id": "J40-bridges",
      "stage": "bridges",
      "title": "Build QSEN to AACN bridge table",
      "objective": "Create one bridge row per QSEN statement to AACN subcompetency code while preserving source row and cell provenance.",
      "depends_on": [
        "J30-dimensions"
      ],
      "outputs": [
        "Bridge_QSEN_AACN"
      ],
      "validation_checks": [
        "multi-code source cells are split",
        "duplicate and malformed codes are flagged"
      ]
    },
    {
      "job_id": "J50-master",
      "stage": "master",
      "title": "Build flattened canonical master",
      "objective": "Join normalized QSEN rows, AACN competency metadata, subcompetency mappings, provenance, and review status into a release table.",
      "depends_on": [
        "J40-bridges"
      ],
      "outputs": [
        "Master_Canonical"
      ],
      "validation_checks": [
        "master bridge row count matches bridge table",
        "review status is visible"
      ]
    },
    {
      "job_id": "J60-coverage",
      "stage": "coverage",
      "title": "Build coverage and review outputs",
      "objective": "Summarize mapping coverage by QSEN domain, KSA, AACN domain, and review reason.",
      "depends_on": [
        "J50-master"
      ],
      "outputs": [
        "Coverage_Summary",
        "Review_Queue"
      ],
      "validation_checks": [
        "coverage totals reconcile",
        "review queue count matches QA JSON"
      ]
    },
    {
      "job_id": "J70-release",
      "stage": "release",
      "title": "Assemble Excel release workbook",
      "objective": "Create the final local workbook with README, Summary, Provenance, Data Dictionary, dimensions, fact, bridge, master, coverage, and review queue sheets.",
      "depends_on": [
        "J60-coverage"
      ],
      "outputs": [
        "outputs/prelicensure_qsen_aacn_crosswalk_release.xlsx"
      ],
      "validation_checks": [
        "required sheets exist",
        "workbook opens"
      ]
    },
    {
      "job_id": "J80-qa",
      "stage": "qa",
      "title": "Validate release and write QA manifest",
      "objective": "Write QA JSON with source hash, source counts, bridge counts, review queue count, and reconciliation status.",
      "depends_on": [
        "J70-release"
      ],
      "outputs": [
        "prelicensure_crosswalk_qa.json"
      ],
      "validation_checks": [
        "source workbook still exists",
        "source archive still exists",
        "all output files exist"
      ]
    }
  ]
}
